Title,Link,Comment,Date
"Small b blogging","https://tomcritchlow.com/2018/02/23/small-b-blogging/","This blog post kind of sums up my approach to blogging.","Fri, 28 Mar 2025 18:48 GMT"
"Using linkhut to signal-boost my bookmarks","https://drewdevault.com/2025/03/27/2025-03-27-Using-linkhut.html","The blog post that inspired this.","Fri, 28 Mar 2025 20:38 GMT"
"How Sonic DNA Connects Generations of Music","https://pudding.cool/2025/04/music-dna/","","Mon, 31 Mar 2025 14:12 GMT"
"Betrayed By Trump","https://www.betrayedbytrump.com/","","Tue, 01 Apr 2025 15:40 GMT"
"The Memetic Leptaniform","https://sunniva.garden/en/The-Memetic-Leptaniform","","Tue, 01 Apr 2025 20:19 GMT"
"That's Bait - by Jeff Sharlet","https://slowcivilwar.substack.com/p/thats-bait","","Wed, 02 Apr 2025 13:44 GMT"
"Dark Mode Toggles Should be a Browser Feature - Bram.us","https://www.bram.us/2022/05/25/dark-mode-toggles-should-be-a-browser-feature/#comments","I'm trying to add dark mode... why is dark mode all or nothing in browsers?","Wed, 02 Apr 2025 19:53 GMT"
"There is no such thing as an 'illegal immigrant' | Mehdi Hasan | The Guardian","https://www.theguardian.com/commentisfree/2025/apr/02/undocumented-people-no-such-thing-as-illegal-immigrant","","Thu, 03 Apr 2025 17:13 GMT"